Video Caption,Comment
美国参加冬奥 还是出事了！美国运动员拒绝与中国队同台参赛，宣布退出北京冬奥，下一秒中国直接宣布，美国队做梦想不到是这种下场！#北京冬奥会#,你又何在夫
美国参加冬奥 还是出事了！美国运动员拒绝与中国队同台参赛，宣布退出北京冬奥，下一秒中国直接宣布，美国队做梦想不到是这种下场！#北京冬奥会#,M国退缩了，就像他们的国力一样日渐衰退了
美国参加冬奥 还是出事了！美国运动员拒绝与中国队同台参赛，宣布退出北京冬奥，下一秒中国直接宣布，美国队做梦想不到是这种下场！#北京冬奥会#,一个盗窃金牌的国家诞生了
美国参加冬奥 还是出事了！美国运动员拒绝与中国队同台参赛，宣布退出北京冬奥，下一秒中国直接宣布，美国队做梦想不到是这种下场！#北京冬奥会#,美國政府不代表美國人民，拜登所做的與美國人民無關，美國政客不在乎美國人民需要什麼，也不提供人們想要什麼，這就是 美國政治體制下的真正問題。 美國的政客不是為人民服務，而是利用人民。 所有與中國和中國人民的問題，完全是美國政客的問題，而不是美國人民的問題，我們愛和平不愛戰爭，我們愛與他人相處，不反對彼此，我們愛和平反對 戰爭，就像你一樣。
美国参加冬奥 还是出事了！美国运动员拒绝与中国队同台参赛，宣布退出北京冬奥，下一秒中国直接宣布，美国队做梦想不到是这种下场！#北京冬奥会#,美国的疑心病又犯了
美国参加冬奥 还是出事了！美国运动员拒绝与中国队同台参赛，宣布退出北京冬奥，下一秒中国直接宣布，美国队做梦想不到是这种下场！#北京冬奥会#,厚脸皮，没有中国世界将美丽
美国参加冬奥 还是出事了！美国运动员拒绝与中国队同台参赛，宣布退出北京冬奥，下一秒中国直接宣布，美国队做梦想不到是这种下场！#北京冬奥会#,西方国家的媒体没有职业道德。
美国参加冬奥 还是出事了！美国运动员拒绝与中国队同台参赛，宣布退出北京冬奥，下一秒中国直接宣布，美国队做梦想不到是这种下场！#北京冬奥会#,他们无有说中国在歺里下毒已经有良心。
美国参加冬奥 还是出事了！美国运动员拒绝与中国队同台参赛，宣布退出北京冬奥，下一秒中国直接宣布，美国队做梦想不到是这种下场！#北京冬奥会#,砍断高麗棒
美国参加冬奥 还是出事了！美国运动员拒绝与中国队同台参赛，宣布退出北京冬奥，下一秒中国直接宣布，美国队做梦想不到是这种下场！#北京冬奥会#,美国隊能滚多远滾多远
美国参加冬奥 还是出事了！美国运动员拒绝与中国队同台参赛，宣布退出北京冬奥，下一秒中国直接宣布，美国队做梦想不到是这种下场！#北京冬奥会#,大外宣
美国参加冬奥 还是出事了！美国运动员拒绝与中国队同台参赛，宣布退出北京冬奥，下一秒中国直接宣布，美国队做梦想不到是这种下场！#北京冬奥会#,奧運美国做假，奥運已沒要看需要，假奥運，假比赛
美国参加冬奥 还是出事了！美国运动员拒绝与中国队同台参赛，宣布退出北京冬奥，下一秒中国直接宣布，美国队做梦想不到是这种下场！#北京冬奥会#,美国輸唔起
美国参加冬奥 还是出事了！美国运动员拒绝与中国队同台参赛，宣布退出北京冬奥，下一秒中国直接宣布，美国队做梦想不到是这种下场！#北京冬奥会#,其他国家裁判做馬，
美国参加冬奥 还是出事了！美国运动员拒绝与中国队同台参赛，宣布退出北京冬奥，下一秒中国直接宣布，美国队做梦想不到是这种下场！#北京冬奥会#,美国怕輸
美国参加冬奥 还是出事了！美国运动员拒绝与中国队同台参赛，宣布退出北京冬奥，下一秒中国直接宣布，美国队做梦想不到是这种下场！#北京冬奥会#,日本队是习惯了没有观众的东京似的奥运会，那样才不会被影响发挥；美国肯定不会理解疫情期间的隔离规范，毕竟东京奥运会的时候美国队也没被关在奥运村，而是被本儿子安排在高档宾馆，随便进出随便传播民主病毒的。这些都好理解，只是这次北京冬奥的视频，网上根本没有是怎么回事？？？全是照片！
美国参加冬奥 还是出事了！美国运动员拒绝与中国队同台参赛，宣布退出北京冬奥，下一秒中国直接宣布，美国队做梦想不到是这种下场！#北京冬奥会#,支持！
美国参加冬奥 还是出事了！美国运动员拒绝与中国队同台参赛，宣布退出北京冬奥，下一秒中国直接宣布，美国队做梦想不到是这种下场！#北京冬奥会#,即如此回想起来 之前根本就不该来吧 。
美国参加冬奥 还是出事了！美国运动员拒绝与中国队同台参赛，宣布退出北京冬奥，下一秒中国直接宣布，美国队做梦想不到是这种下场！#北京冬奥会#,"冬奧會之後
友誼長聚首！所有參加者五年內中國旅遊入境優惠！中國行 YouTube視頻 全球比賽""以上皆以（ 數字人民幣支付）前怕狼""後怕虎""畏戰先輸！養兵不戰""將帥畏死""文官貪財""亡國先兆""祛除全國全黨""恐美症""
統一台灣之前""武統""文統""智統多管齊下！
難道要不斷再為台獨付出每年國際成本""等台獨霉國掏空台灣""80%台民贊成台獨才能收復台灣""讓香港新疆內蒙再獨立！連自己旁邊的小島都無法統一？還談什麼民族復興？不管中國如何統一台灣""霉國西方都會搗蛋制裁""香港""新疆就是教訓！
霉國台毒先改變現狀""切香腸！自己附近領土來比""切香腸！疲勞轟炸打擊台軍""心戰喊話""威脅利誘台軍！麻痺島民軍政心理！
飛機船艦飛越台灣領空領海常態化 飛越台灣全島""""降落台灣機場港口""！透過網路廣告廣播宣傳運輸建設金融外交人員 各方面把台灣內政化""
孤立打擊台毒集團 金主""及台毒人員出國限制""喚醒被迷惑的群眾"" 拉攏 擁護統一的群眾！
頒布台軍政警公務人員投誠""支援解放軍的方法與獎勵措施""區分遠離台毒霉國軍事人員方法""避免台毒霉軍偷走台黃金""故宮國寶！

!疫情病毒越嚴重""中國越強大""霉國西方越需中國商品""越是統一台灣好時機成熟！難道要等收被台毒霉國掏空搞爛的台灣？
連自己旁邊的小島都無法統一？還談什麼民族復興？不管中國如何統一台灣""霉國西方都會搗蛋制裁""香港""新疆就是教訓！
沒有一個大國""霉國西方國家會真心想讓中國統一""當斷不斷""倍受其亂""亮劍斬首""速戰速決""造成事實""建立歷史功業""沒有一帆風順""卻要膽識過人""不怕險阻""排除萬難！"
美国参加冬奥 还是出事了！美国运动员拒绝与中国队同台参赛，宣布退出北京冬奥，下一秒中国直接宣布，美国队做梦想不到是这种下场！#北京冬奥会#,體育精神己漸失，把個人的輸贏看得太重，最後連運動場也是是非之地，現今世界太複雜了，何苦來哉！
