Video Caption,Comment
How the 2022 Winter Olympics Snow Is Made #Shorts,Slave labor
How the 2022 Winter Olympics Snow Is Made #Shorts,"For the last 2 days, it was snowing heavily in Beijing and Zhangjiakou."
How the 2022 Winter Olympics Snow Is Made #Shorts,KAREN............
How the 2022 Winter Olympics Snow Is Made #Shorts,I’m in Washington and my local mountain hasn’t had snow in a little over a month now it sucks
How the 2022 Winter Olympics Snow Is Made #Shorts,"Ok, do u know what is technology? Or u shouldn't live in fake Cool from ac in summer, Or fake warm in winter.... God bless u.... Silly!"
How the 2022 Winter Olympics Snow Is Made #Shorts,Hope it never snows again!
How the 2022 Winter Olympics Snow Is Made #Shorts,Good I hate snow!!!
How the 2022 Winter Olympics Snow Is Made #Shorts,Beautiful
How the 2022 Winter Olympics Snow Is Made #Shorts,And no reporting of green energy that is being used in beijing? 🤔
How the 2022 Winter Olympics Snow Is Made #Shorts,Anyone care that this lady is super hot???
How the 2022 Winter Olympics Snow Is Made #Shorts,"How ridiculous is this? Winter Olympics artificial ice for skating is ok. Artificial snow is a No No. Canada Olympics “fake snow” is ok, Beijing Olympics “fake snow” is a No No. Bruh"
How the 2022 Winter Olympics Snow Is Made #Shorts,Long live the new global leader: CHINA  !!!
How the 2022 Winter Olympics Snow Is Made #Shorts,"It doesn't matter  if it's man made snow or not, It's more important that if you can competeSafely and efficiently"
How the 2022 Winter Olympics Snow Is Made #Shorts,It's also treated wastewater 🤢
How the 2022 Winter Olympics Snow Is Made #Shorts,so poorly educated host. go and learn how the snows ❄️ were made with green technology. You are so behind technology 🤣
How the 2022 Winter Olympics Snow Is Made #Shorts,Wow 😞
How the 2022 Winter Olympics Snow Is Made #Shorts,Super bad for the environment!
How the 2022 Winter Olympics Snow Is Made #Shorts,Don't many ski resorts do this
How the 2022 Winter Olympics Snow Is Made #Shorts,"Not really related, but this is the 666th video on this channel."
How the 2022 Winter Olympics Snow Is Made #Shorts,We're wasting water we don't have to make snow for a game we don't need
