Video Caption,Comment
Bobsleigh Recap | Winter Olympics 2018 | PyeongChang,Want more Bobsleigh from PyeongChang? Click Here: http://bit.ly/2Ff8sZz
Bobsleigh Recap | Winter Olympics 2018 | PyeongChang,Germany just loves driving vehicles don't they?
Bobsleigh Recap | Winter Olympics 2018 | PyeongChang,How do they fight in the thing?
Bobsleigh Recap | Winter Olympics 2018 | PyeongChang,My Dream 💜🙏
Bobsleigh Recap | Winter Olympics 2018 | PyeongChang,I wanna try that
Bobsleigh Recap | Winter Olympics 2018 | PyeongChang,India is coming... emerging gold medalist in Beijing 2022...
Bobsleigh Recap | Winter Olympics 2018 | PyeongChang,Germany is the by far the coolest country out there
Bobsleigh Recap | Winter Olympics 2018 | PyeongChang,came here after italy's tamberi and qatar's barshim also shared the gold in tokyo 2020 men's high jump.
Bobsleigh Recap | Winter Olympics 2018 | PyeongChang,cool
Bobsleigh Recap | Winter Olympics 2018 | PyeongChang,What? No broom on the track?
Bobsleigh Recap | Winter Olympics 2018 | PyeongChang,WEEEEE!
Bobsleigh Recap | Winter Olympics 2018 | PyeongChang,How ten year old me felt when sledding:
Bobsleigh Recap | Winter Olympics 2018 | PyeongChang,Cada bobsledero posee alto nivel.
Bobsleigh Recap | Winter Olympics 2018 | PyeongChang,Came here from watermelon
Bobsleigh Recap | Winter Olympics 2018 | PyeongChang,NICE GUYS
Bobsleigh Recap | Winter Olympics 2018 | PyeongChang,Online lekcje
Bobsleigh Recap | Winter Olympics 2018 | PyeongChang,I love how the german and Canadian teams immediately celebrated their gold medals together.
Bobsleigh Recap | Winter Olympics 2018 | PyeongChang,Cool Runnings
Bobsleigh Recap | Winter Olympics 2018 | PyeongChang,"Hey, Vietnam. We got our wish. Looks like the black guy wants to dance with the Dragon. Don't worry. When we lose, I'll be in heaven with you."
Bobsleigh Recap | Winter Olympics 2018 | PyeongChang,OMG
